sentence,macroeconomic factor
b c domestic demandconsumption change gross domestic capital formation change total domestic demand change external demandexport good service change,
import good service change,
total demand change base gdp estimate base year revise,
provisionalsource department census statisticscentral bank sri lanka,
central bank sri lanka annual report gce comprise individual collective final consumption expenditure government grow cent current price compare cent growth record,
accordingly government individual final consumption expenditure main gce category comprise expenditure health education social protection recreation culture grow cent year compare cent growth,
government collective final consumption expenditure comprise expenditure collectively benefit community general public service defence public order safety grow cent slow rate compare cent growth,
investmentinvestment expenditure current price grow cent compare cent growth significant elevation price investment good investment real term record notable contraction,
investment climate face strong headwind year attributable scarcity increase cost investment good shortage foreign exchange sharp depreciation local currency holdback government fund construction project high interest rate environment,
current price gross fix capital formation major contributor investment expenditure grow cent compare cent growth record previous year reflect impact increase price construction material machinery equipment,
meantime change inventory acquisition disposal valuable increase year,
foreign direct investment fdi inflow include loan receive company register boi increase notably cent year year dollar million compare dollar million record,
fdi include receipt include loan company register boi differ estimate present mainly inclusion fdis non boi company,
accordingly total fdi amount dollar million table composition private consumption expenditure current market price categoryas percentage total pce growth b c c,
food non alcoholic beverage alcoholic beverage tobacco narcotic clothing footwear housing water electricity gas fuel furnishing household equipment routine household maintenance,
direct purchase abroad resident,
direct purchase domestic market non resident total private consumption expenditure base gdp estimate base year revise,
provisional source department census statistic,
national output expenditure income employmentinflow infrastructure project account cent total fdi inflow boi company show notable increase largely contribute overall expansion fdis,
fdi manufacturing sector service sector account cent cent fdi inflow respectively record expansion,
fdi inflow agriculture sector continue remain modest,
total value project approve year boi section boi act,
estimate rs billion depict expansion cent year year rs billion precede year,
estimate investment value project commence commercial operation section boi act amount rs billion rs billion respectively availability utilisation resourcesthe available resource economy include domestic resource represent gdp external resource represent import grow high rate cent current price compare cent growth record,
regard gdp grow cent import grow cent year high rate compare,
consider constant price estimate gdp import record contraction,
available resource utilise consumption purpose account table investment employment enterprise register board investment sri lanka boi ministry industriescategoryno project estimate investment rs million e,
employment b b b foreign local total foreign local totalboi act project approve section section project contract section realise investment section e project commercial operation section,
ministry industriescompanies register n n revise source board investment sri lanka ministry industries provisional include expand project cumulative end year cumulative actual investment value givennote project approve contract sec boi act exempt customs exchange control regulation subject fulfilment investment threshold specify requirement,
figure foreign direct investment boi enterprise million include loan source board investment sri lanka infrastructureservicesmanufacturingagriculture,
central bank sri lanka annual report cent total resource utilisation current price share investment export stand cent cent respectively,
savingsthe country domestic national saving improve current price year,
accordingly domestic saving grow cent compare cent growth record drive increase private saving despite broadening government dis saving year,
result domestic saving percentage gdp increase cent,
rupee term figure economy current market price base gdp estimate base year,
source department census statisticscentral bank sri lankaexport good service investment demand good service rs billion privateconsumption governmentconsumption supply good service rs billion import goodsand service taxis subsidy product wholesale andretail trade transportation andstorage accommodation andfood service activity information andcommunication financial insurance andreal estate activity professional service andother personal serviceactivitie public administration defence education human health andsocial work activity agriculture andforestry fishing mining andquarrye manufacture electricity waterand waste treatment construction service table consumption investment saving current market price b item rs million growth,
gross domestic product market price consumption expenditure private government,
domestic saving private government,
domestic saving investment gap,
net primary income rest world,
net current transfer rest world,
national saving base gdp estimate base year,
difference bop estimate time lag compilation,
source department census statisticscentral bank sri lankaministry finance economic stabilization national policiestable total resource use currentmarket price b,
itempercentage share growth c resourcesgross domestic product import good service total utilisationconsumption gross fix capital formation change inventory acquisition disposal valuable export good service total base gdp estimate base year provisional,
revisedsource department census statistic central bank sri lanka,
national output expenditure income employmentnet primary income rest world deteriorate year net current transfer rest world record improvement,
combine outcome development national saving grow cent compare cent growth,
high growth saving compare investment national saving investment gap narrow,
incomegross mixed income large income component economy grow cent current price year compare growth cent record account cent gva,
gross operating surplus second large income component grow cent compare growth cent,
term major source income compensation employee taxis subsidy production continue expand year,
consider institutional sector classification gva nfc large income generator follow hh npish gg fc respectively population labour force employmentpopulation population continue increase slow rate compare previous year,
accordingly mid year population sri lanka estimate million mid year population estimate compile registrar general department record marginal growth cent compare growth cent,
western province continue account high share cent mid year population record year year decline population follow central southern province represent cent cent population respectively,
northern province continue account cent low share mid year population,
line population growth population density increase marginally people square kilometre people square kilometre record,
follow trend observe recent year female population remain high male population,
table income component institutional sector current market price b itempercentage share non financialcorporation nfc financialcorporation fc generalgovernment gg householdsand non profit institutionsservinghousehold hh npish total economynon financialcorporation nfc financialcorporation fc generalgovernment gg householdsand non profit institutionsservinghousehold hh npish total economycompensation employee gross operating surplus gross mixed income taxis subsidy production gross value add basic price base gdp estimate base year provisional,
revisedsource department census statistic,
central bank sri lanka annual report labour force economically inactive population increase compare result decrease labour force sri lanka labour force survey conduct dcs,
line increase household population economically inactive population increase million million previous year labour force represent economically active population decrease marginally million million record,
development labour force participation rate lfpr ratio labour,
current economically active population e number person aged year employ unemployed reference week period,
force household population decrease marginally cent compare cent,
male lfpr record decline cent cent previous year positive note female lfpr increase cent cent previous year,
gender gap lfpr narrow cent compare cent record previous year,
employmentthe employ population increase million compare million previous year,
term employment major economic activity employment industry activity increase million million previous year service increase million million previous year,
employment agriculture decline million million previous year,
accordingly share employment industry service activity increase cent cent respectively cent cent previous year share employment agriculture decline cent cent previous person work hour reference period pay employee employer account worker contribute family worker say employ,
include person job work reference period,
table province wise population density b province,
population personsdensity population personsdensitywestern central southern northern eastern north westen north central uva sabaragamuwa total,
provisional mid year population datum base census population housing source registrar general department table household population labour force labour force participation item q q annualhousehold population person,
labour force person employ unemployed labour force participation rate male female household population aged year provisional,
labour force percentage household populationsource department census statistic,
national output expenditure income employmentyear,
term status employment public sector employee account worker contribute family worker decrease compare private sector employee employer increase,
private sector continue remain main employment generator sri lanka represent large share cent follow account worker account cent total employment,
datum department management service ministry finance total public sector employment stand million,
include employee ministry departments district secretariat divisional secretariat provincial council state own enterprise soe,
accordingly public sector employment record decline compare million report reduction employment soe,
unemploymentthe unemployment rate decline cent cent record previous year,
unemployed population decline million million record previous year,
consequently male unemployment rate remain unchanged cent female unemployment rate decline cent cent previous year,
unemployment rate person available look work work take step find job week ready accept job give work opportunity week say unemployed gce l category decline considerably cent compare cent record previous year,
youth year unemployment rate decline cent compare cent previous year,
foreign employment departure foreign employment record significant growth cent,
significant increase departure foreign employment partly account economic hardship prevail country,
accordingly male female departure foreign employment account cent cent respectively total table public sector employmentsector b percentage change government state own enterprise total public sector revise source department management services ministry finance economic stabilization national policy,
provisionalfigure unemployment rate cent source department census statisticsoverall female male figure departure foreign employment skillsunskille housemaidsprofessional skilled middle level clerical related semi skilledsource sri lanka bureau foreign employment number person,
central bank sri lanka annual report departure foreign employment,
departure skill category professional middle level clerical related skilled semi skilled unskille housemaid increase major contribution unskilled skilled housemaid category,
middle east region continue main foreign employment destination account cent total departure foreign employment cent depart qatar saudi arabia united arab emirate kuwait,
labour productivity labour productivity measure term gva price hour work decline cent rs,
decline labour productivity industry service activity mainly decrease respective gva,
accordingly labour productivity industry service activity decline rs hour work rs hour work respectively rs hour work rs hour work respectively,
contrary labour productivity agriculture activity broadly remain unchanged amid decline agriculture gva hour work,
accordingly labour productivity agriculture activity record rs hour work compare,
term level productivity service activity continue exhibit efficient use labour resource record high labour productivity level follow industry agriculture activity,
table departure foreign employmentforeign employment b number cent number cent number centtotal placement,
manpower categoryprofessional middle level clerical relate skilled semi skilled unskilled housemaid revise provisionalsource sri lanka bureau foreign employmentfigure departure foreign employment major destinationssource sri lanka bureau foreign employment kuwait qatar saudi arabia othernumber person,
