sentence,macroeconomic factor
overviewthe sri lankan economy contract cent year year basis record high contraction backdrop bad economic crisis experience post independence economy prudent policy intervention avert possible deepening crisis,
economic crisis initially cause supply disruption form severe shortage consumer good energy source include fuel electricity input industry mainly account sharp depletion foreign exchange liquidity market lead significant increase price,
situation compel central bank government introduce painful essential policy measure unprecedented adjustment policy interest rate curtail inflationary pressure prioritisation essential import minimise foreign exchange outflow prevent worsening crisis,
measure contribute contain demand pressure minimise supply disruption improve availability essential import include fuel material industry gradually stabilise economy,
reflect impact economic stress major economic activity industry service agriculture contract year,
setback manufacture construction mining quarry activity lead contraction industry activity contraction observe particularly real estate activity include ownership dwelling insurance financial service negatively affect service activity outpace positive spillover recovery tourist arrival record year year basis,
subdue performance fishing activity cause fuel shortage animal production owe shortage animal feed grow rice vegetable drive lack fertiliser dampen overall growth agriculture activity,
situation turn result decline labour productivity despite favourable development key labour market indicator,
expenditure consumption investment grow significantly current price induce elevated price level,
constant price investment consumption contract drive deterioration purchase power hold investment soar inflation high borrowing cost,
hand net external demand current price improve substantial growth export good service benefit sharp depreciation sri lanka rupee surpass growth import good service,
relatively slow growth import largely result dry forex liquidity banking sector restriction non essential import sharp depreciation rupee significant tightening monetary policy,
national output expenditure income employment,
central bank sri lanka annual report gross domestic product gdp gross national income gni gdp capitathe gross domestic product gdp constant market price hereinafter refer constant price contract historically high rate cent compare growth cent record crucial policy measure implement central bank government help address adverse economic headwind confront country,
gdp current market price hereinafter refer current price estimate rs billion department census statistic dcs estimate gdp production expenditure income approach dollar billion increase cent rupee term compare rs,
high growth gdp current price table gross domestic product industrial origin constant price b economic activitygrowth contribution growth percentage gdp c agriculture forestry fishing grow cereal rice growing rice growing vegetable grow sugar cane tobacco non perennial crop grow fruit grow oleaginous fruit coconut king coconut oil palm,
grow tea green leave grow beverage crop coffee cocoa etc,
grow spice aromatic drug pharmaceutical crop grow rubber,
grow perennial crop animal production,
plant propagation agricultural support activity forestry log fishing industry mining quarry manufacture electricity gas steam air conditioning supply water collection treatment supply sewerage waste treatment disposal activity construction service wholesale retail trade transportation storage accommodation food service activity information communication financial insurance real estate activity include ownership dwelling professional service personal service activity public administration defence education human health social work activity equal gross value add gva basic price taxis subsidy product equal gross domestic product gdp market price net primary income rest world gross national income market price base gdp estimate base year,
source department census statistic provisional revisedfigure annual gdp growth rate source department census statistic base gdp estimate base year agriculture industry service gdp cent,
national output expenditure income employmentfigure snapshot national output expenditure income employment departure foreignemploymentunemploymentrateemployedpopulationlabour force labour forceparticipation rateeconomically inactivepopulation mn mn mn mn mn mn labour market indicatorsnet operating surplusgrossoperatingsurplus export good andservicesimport good serviceskey driver,
increase expenditure social protection educationgovernment consumptionkey driver,
increase expenditure food transportprivate consumptionkey driver increase gross domestic fix capital formationgross domestic capital formationnet exportskey driver increase export absolute value gross operating surpluscompensation employeesnet operating surplusconsumption fixedcapitalnet mix incomeother axis subsidieson production consumption fixedcapital taxis subsidiesserviceskey driver contraction real estate insurance activitieskey driver contraction grow ofrice animal productionagriculturekey driver contraction manufacturingand construction activitiesindustry industry,
taxis lesssubsidie servicesgross valueadde constant,
pricesproduction approach expenditure approach income approach gross mixed income compensationof employee current market pricescurrent market pricesconsumption offixe capitalconsumption offixed capitalother taxis subsidy productiongross mixedincome net mixedincome taxis subsidiesprivateconsumptiongross domesticcapital formation net exportsgovernmentconsumptiongross domesticexpenditure agriculture agricultureservice industrygdp growth right axis,
taxis subsidy gross domestic product constant price rs,
tnper cent centsaving investment gdp gdp currentmarket pricesrs bnus bn mid yearpopulation person capita gdprs sri lankan economy record deep contraction backdrop bad economic crisis national saving investment,
central bank sri lanka annual report mainly reflect impact increase price level year indicate surge gdp implicit deflator cent cent record,
gross national income gni estimate adjust gdp net primary income rest world grow cent current price compare growth cent record,
growth gni year merely reflect increase gdp current price net primary income rest world deteriorate,
gdp capita increase rs dollar compare rs dollar,
increase gdp capita rupee term drive significant increase gdp current price gdp capita dollar term decline substantial depreciation sri lanka rupee dollar year,
gni capita estimate rs dollar compare rs dollar contribution institutional sectorsthe non financial corporation nfc sector represent cent share large contributor gross value add gva estimate current market price,
accordingly nfc sector grow cent compare growth cent previous year,
nfc sector remain large contributor industry activity agriculture service activity mainly contribute household non profit institution serve household hh npish sector,
hh npish general government gg financial corporation fc sector grow cent cent cent respectively,
output policy institutional support issuesagriculturethe supply headwind include severe shortage agricultural input particularly fertiliser agrochemical substantial increase production cost disruption fuel supply hamper overall performance agriculture activity,
accordingly agriculture activity contract cent value add term compare growth cent record mainly significant contraction total fishing grow rice animal production,
addition figure percentage share gross value add gva institutional sector current market price source department census statistic base gdp estimate base year nfcfcgghh npishtotalgva agriculture industry service,
national output expenditure income employmentintroductionnational account estimate critical input economic analysis policymaking reflect real sector development economy,
essential accommodate change economic price structure economy time national account estimate regular rebase exercise,
fulfil requirement base year sri lankan national account estimate revise time time history late,
department census statistic dc official compiler update base year national account estimate replace previous base year,
alongside late rebasing exercise dcs expand production boundary broaden coverage economic activity improvement compilation methodology,
expand production boundary coverage economic activitiesthe coverage economic activity broaden late rebasing exercise,
major coverage expansion inclusion reclamation work relate colombo international financial city cifc project industry activity carry period take account percentage work year,
lead considerable fluctuation gross domestic product gdp estimate corresponding gdp growth rate period,
coverage agriculture service activity broaden rebase exercise,
coverage improvement rebase gdp estimate relate production approach disseminate economic activity instead economic activity series,
attributable estimation plant propagation agricultural support activity separately new base year,
term agriculture activity coverage improvement introduce grow box rebasing national account estimate base year fruit oil palm flower plant propagation household log production agricultural support activity,
term service activity coverage area information technology warehousing activity broadcast activity courier service financial service broaden rebase exercise,
methodological improvement use new datum sourcesdure rebase exercise methodological improvement adopt estimate economic activity agricultural support activity forestry log plant propagation flower plant manufacture construction electricity generation program consultancy accommodation service food beverage service activity wholesale retail trade activity,
new data source include economic census information technology information technology enable service survey revenue information relate register company colombo stock exchange cse incorporate compile rebase estimate base year,
dcs adopt double deflation method place single deflation method compile estimate economic activity constant price new base year,
key outcome rebase national account estimate base year,
base year revision affect economic indicator size economy value gdp gdp growth rate share major economic activity gdp,
compare previous base year rebase gdp estimate constant price indicate level shift attributable,
central bank acknowledge information constructive feedback provide dcs prepare extended version article publish news survey volume number topic rebasing national account estimate base year,
single deflation method output intermediate consumption ic deflate price index double deflation method output ic deflate different price index compile constant price estimate accurately,
table comparison recent gdp rebase exercise gdp current price rs million,
level shift current price source department census statistic,
central bank sri lanka annual report replacement base year price price capture evolution price coverage methodological improvement,
consequently corresponding gdp growth rate affect base year revision,
particularly addition reclamation work relate cifc project lead considerable shift gdp level growth rate period reflect datum present table figure base year revision contribution gdp major component agriculture industry service taxis subsidy product change especially increase share industry activity decline share service activity taxis subsidy product show figure follow increase gdp estimate current price macroeconomic indicator express percentage gdp budget deficit debt gdp revise,
generally rebase process provide policymaker stakeholder representative set economic statistic exist economic structure well evidence base decision make,
refer rebase gdp estimate imperative understand impact event separately impact long last event evaluate appropriately,
key finding rebase gdp estimate base year,
available http www statistics gov lk nationalaccounts staticalinformation report,
thilangani k liyanage n,
rebasing national account estimate base year news survey vol,
available https www cbsl gov lk site default file publication satahana pdffigure comparison gdp estimate constant price gdp growth rate source department census statistic base year base year base year base year gdp growth rate cent level gdp rs bn figure comparison share gdp constant price source department census statisticsagricultureindustryservicestaxe subsidy product,
ase year ase year ase year ase year,
cent growing tea vegetable cereal rubber decline year,
forestry log agriculture support activity grow oleaginous fruit include coconut spice fruit increase year,
positive note recovery agriculture activity observe quarter year improved availability agricultural input fuel favourable weather condition,
reflect subdued performance agriculture activity production demand sub index relate agriculture segment figure growth rate agriculture activity grow oleaginous fruit include coconut,
source department census statistic base gdp estimate base year grow cereal rice grow teagrowing riceanimal productionfishing activitiesgrowing vegetablesgrowe rubbergrowe fruitsgrowing spicesagricultural support activitiesforestry log,
national output expenditure income employmentthe business outlook survey bo conduct central bank record contraction average year,
index agricultural productionthe volume index agricultural production viap measure output agriculture sector record significant contraction,
overall viap contract cent year year compare year year growth cent,
sub index include paddy tea rubber livestock livestock product contribute overall decline fruit sub index record significant improvement coconut sub index compare previous year,
paddytotal paddy production country decline significantly record low annual production amidst severe supply disruption include shortage fertiliser,
business outlook survey summarise information reveal response lead corporate select accordance composition gdp,
volume index agricultural production compile dcs replace agriculture production index api compile central bank sri lanka,
importation inorganic fertiliser agrochemical sequel ban compound lack foreign exchange import require fertiliser result acute fertiliser shortage country have significant bearing paddy sector,
follow bumper harvest annual paddy production record decline cent year year million metric ton,
combine outcome cent decline maha season account cent total production cent drop paddy harvest yala season,
net land extent harvest year marginally decline cent hectare average yield paddy decline kilogramme hectare compare kilogramme hectare record reflect impact input shortage productivity slowdown season,
total paddy production equivalent million metric ton rice approximately month sufficiency household rice demand,
order arrest price pressure stem rice shortage domestic market meet overall rice requirement country ensure food security government initiate measure import rice year,
accordingly metric ton rice import compare metric ton rice import previous year,
domestically available rice stock gradually increase import stock harvest yala season ban impose importation rice variety effect december,
elevate input cost combine drop production result high paddy rice price,
continue trend level sufficiency base average household rice consumption estimate household income expenditure survey hie,
actual rice demand country significantly high hie average household rice consumption estimate exclude rice demand source restaurant hotel rice base food industry etc,
table volume index agricultural production item growth rate,
overall index tea rubber coconut paddy coarse grain food crop vegetable fruit livestock livestock product minor export crop source department census statistic volume index agricultural production compile department census statistic replace agriculture production index api compile central bank sri lanka,
central bank sri lanka annual report observe late paddy price record increase early largely drive supply shortage stem low production maha season increase demand result market speculation supply shortage market,
government intermittently intervene paddy rice market reduce price volatility maintain steady supply,
accordingly guarantee purchasing price kilogramme samba nadu keeri samba paddy increase rs rs rs respectively maha season pursuant paddy purchasing programme paddy marketing board pmb,
pmb able purchase metric ton paddy maha season,
consider escalation cost production paddy sector pmb increase guarantee purchase price kilogramme samba nadu keeri samba paddy rs rs rs respectively yala season,
pmb able purchase metric ton paddy new guarantee price lack funding available pmb purchase paddy compelling farmer sell paddy stock low price private miller cause moderation paddy price late,
average price variety paddy remain price level observe,
average price samba paddy record notable increase cent year year rs kilogramme rs kilogramme record average price nadu paddy increase substantially rs kilogramme rs kilogramme record register year year increase cent previous year,
follow similar trend paddy price price rice variety show upward trend despite moderation late,
accordingly average retail price samba nadu rs kilogramme rs kilogramme respectively compare rs kilogramme rs kilogramme respectively,
measure undertake government stabilise retail rice price market include imposition maximum retail price mrp rice variety boost supply rice import address excessive volatility retail rice price amidst shortfall rice supply local market,
accordingly mrp nadu samba keeri samba impose rs kilogramme rs kilogramme rs kilogramme respectively effective table paddy sector statisticsitem unit b,
maha yala total maha yala totalgross extent sow hectare,
gross extent harvest hectare net extent harvest hectare production mt bushel yield hectare kg hectare credit grant banking sector,
mn rice import mt paddy equivalent import rice mt revise,
provisional yield hectare calculate divide production net extent harvest,
commence datum cultivation loan grant lending bank available separately maha yala season,
annual figuresource department census statisticssri lanka customscentral bank sri lanka,
national output expenditure income employmentfrom,
alleviate impact persistently high price government launch programme purchase nadu paddy farmer rs kilogramme maha season intention distribute kilogramme rice month low income family march april,
measure undertake government address contemporary issue agriculture sector strive improve long term productivity sector,
consideration adverse effect inadequate fertiliser availability emanating banning importation chemical fertiliser agrochemical limited liquidity domestic foreign exchange market facilitate fertiliser import government expedite measure provide chemical fertiliser quarter,
accordingly government procure metric ton urea indian line credit yala cultivation distribution urea paddy farmer subsidised price rs kilogramme sack urea yala season,
addition arrangement international organisation include world bank wb asian development bank adb food agriculture organisation fao assistance programme grant ensure timely supply require urea triple super phosphate tsp muriate potash mop fertiliser maha season upcoming season,
accordingly government able disburse metric ton urea paddy cultivation maha season significantly contribute recovery paddy sector,
consider need allow domestic use glyphosate weedicide cabinet minister grant approval september import require quantity glyphosate agricultural purpose maha season period month,
addition urgent measure take address nutrient deficiency lead yellowing paddy plant certain district maha season provisioning fertiliser organic supplement expedite extension service pest disease management,
addition rice variety screen programme identify good perform variety continue new variety special characteristic short duration high yield drought resistance release,
new variety release industrial purpose biscuit production,
effort improve precision agriculture site specific weed management experiment carry trial paddy field identify major weed type impact weed type paddy field multispectral drone image technology,
teathe production tea register notable decline cent year year largely lag effect acute shortage fertiliser agrochemical domestically,
preliminary diagnosis carry tea research institute tri large decline crop yield region country point inaccessibility figure rice supply demanddomestic supply ricetotal supply ricetotal household demand riceaverage retail price rice right axis average producer price paddy right axis,
source department census statistics sri lanka customs central bank sri lanka price rs kg quantity mt,
central bank sri lanka annual report chemical fertiliser agrochemical particularly urea base fertiliser weedicide significantly impact report yield loss year,
accordingly production high medium low grow tea contribute cent cent cent total production respectively decline cent cent cent respectively,
average yield smallholder sector decrease kilogramme hectare compare kilogramme hectare report register year year decline cent average yield,
tea sector experience rise production cost elevated price chemical fertiliser agricultural input couple domestic shortage input upward adjustment utility price include fuel electricity water hamper country competitiveness global tea market,
consequently estimate cost production tea increase rs rs kilogramme compare,
tea price colombo tea auction cta reach historically high level remain elevated year,
average price tea increase notably cent rs kilogramme year rs kilogramme record,
accordingly average tea price high medium low grown tea report year year increase cent cent cent respectively,
average price receive smallholder green leave increase significantly rs kilogramme compare rs kilogramme,
average export price fob tea increase cent dollar kilogramme compare dollar kilogramme record precede year,
increase average tea price year partly attribute decline quantity supply cta amidst decline local production depreciation sri lanka rupee contribute price hike rupee term,
measure undertake government aim enhance productivity value addition competitiveness sri lanka tea industry,
sri lanka tea board sltb initiate concessionary loan scheme interest rate cent enable tea factory purchase fertiliser green tea leave supplier,
year sltb disburse rs million tea factory factory modernisation subsidy scheme support modernisation activity factory aim improve quality production process,
addition sltb grant rs million replantation subsidy programme enhance productivity tea land subsidy rs million provide installation irrigation sprinkler system acre medium scale tea land,
measure undertake tea small holding development authority tshda relation tea replanting new planting programme crop rehabilitation subsidy programme,
year hectare tea land replant hectare new land convert tea land process infille tea land continue,
year effort enhance awareness tea smallholder carry advisory service,
tri continue effort relation research development activity service project pursuant strategic plan,
accordingly special project development introduction motorise selective tea harvester suitable tea land country establishment seed garden increase production improve seed source planting material drought prone area promotion commercialisation microbial bio pesticide tea cultivation expansion mother bush area new tea cultivar underway year,
national output expenditure income employmentrubberrubber production continue decline second consecutive year largely drive combine effect adverse weather condition prevail rubber grow area fertiliser shortage spread pestalotiopsis disease,
impact fertiliser shortage immature rubber plantation significant cause stunted tree growth cause delay tapping stage plantation reduce land productivity period ahead,
furthermore scarcity agrochemical result severe propagation pestalotiopsis disease rubber plantation year affect hectare rubber plantation result decline yield range cent affect rubber plantation,
accordingly total rubber production decrease cent million kilogramme year year,
major category rubber production sheet rubber production account cent total rubber production contraction cent production category rubber record decline cent year compare,
crepe rubber production record growth cent,
despite notable increase local rubber price productivity tap limitation rubber sector prevent plausible improvement production,
average yield rubber reduce cent year year kilogramme hectare reduction tapping day,
cost production rubber rise record rs kilogramme end register increase cent previous year,
domestic consumption raw rubber industrial sector contract cent million kilogramme partially attribute decline demand medical glove domestic global market covid pandemic fade away,
price variety rubber colombo rubber auction reach historically high level drive favourable demand global market half,
colombo rubber auction annual average price ribbed smoke sheet rss increase rs kilogramme rs kilogramme register year year increase cent average price latex crepe increase notably cent year year rs kilogramme rs kilogramme,
year rubber price decelerate trend mainly weak demand rubber base product domestic global market,
accordingly end average auction price rss latex crepe rubber stand rs kilogramme rs kilogramme respectively,
average fob price rubber marginally increase dollar kilogramme dollar kilogramme record previous year,
strategy improve productivity value addition rubber sector continue,
rubber research institute rri conduct multiple research study year effort increase productivity rubber sector,
