sentence,macroeconomic factor
subsector wear apparel chemical chemical product beverage tobacco product leather related product machinery equipment contribute cent index record overall growth year despite transitory lapse observe occasionally,
food manufacturing activity report significant contraction beverage manufacturing activity register robust growth second consecutive year,
accordingly food product subsector account iip register year year contraction cent figure purchasing manager index manufacturing source central bank sri lanka,
diffusion index range index value neutral level denote expansion value denote contraction respective activity general,
pmi production indexjan feb mar apr mayjun jul aug sep oct nov dec jan feb mar apr mayjun jul aug sep oct nov dec,
central bank sri lanka annual report follow modest growth cent,
subdued performance food product subsector drive decline production rice can fish milk powder wheat flour bread tea mainly crisis induce disruption supply chain distribution channel increase cost raw material packaging material limited supply food ingredient cause import restriction,
contrast performance manufacture beverages subsector record notable expansion subsector iip year account growth production arrack beer soft drink,
accordingly beverage manufacturing activity record year year growth cent year year growth cent,
despite overall positive performance beverage manufacturing activity slight moderation performance sector observe fourth quarter,
manufacturing wear apparel second large subsector iip record favourable recovery largely support recovery global supply chain textile subsector witness contraction,
accordingly manufacturing wear apparel subsector register year year growth cent compare notable growth cent register,
adverse implication import restriction logistic issue power outage wear apparel sector largely offset policy decision initiate government,
include allow exporter buy fuel directly ceylon petroleum corporation cpc dollar provide tariff concession raw material import period review,
additionally depreciation exchange rate global recovery covid pandemic especially key export destination sri lanka positively impact export wear apparel subsector,
manufacturing textile product record robust recovery table index industrial production iip divisionweight iip b change b manufacture food product manufacture beverage manufacture tobacco product manufacture textile manufacture wear apparel manufacture leather related product manufacture wood product wood cork furniture manufacture article straw plait material manufacture paper paper product printing reproduction record medium manufacture coke refined petroleum product manufacture chemical chemical product manufacture basic pharmaceutical product pharmaceutical preparation manufacture rubber plastic product manufacture non metallic mineral product manufacture basic metal manufacture fabricate metal product machinery equipment manufacture electrical equipment manufacture machinery equipment e,
manufacture index industrial production e,
classify source department census statistic revise provisionalfigure index industrial production iip,
source department census statistic janfebmaraprmayjunjulaugsepoctnovdecindex point,
national output expenditure income employmentin pandemic year year growth cent contract significantly cent largely drive decline production finished fabric printing fabric coir fiber,
manufacture non metallic mineral product manufacture basic metal manufacture fabricate metal product subsector register substantial overall decline,
accordingly subsector manufacture non metallic mineral product manufacture basic metal manufacture fabricate metal product record cent year year growth contract cent cent cent respectively year,
contraction demand product subsector mainly subdued demand domestic construction sector face multiple setback follow suspension government fund project soar raw material cost import restriction,
production cement roofing sheet floor tile roofing tile record notable contraction reflect subdued demand construction sector adversely affect performance manufacturing non metallic mineral product,
decline production basic iron steel lead steel furniture largely contribute overall contraction subsector manufacturing basic metal manufacture fabricate metal product subsector period review,
manufacture coke refined petroleum product subsector account cent iip witness contraction consecutive year,
accordingly manufacture coke refined petroleum product decline notably cent year year register historically large annual contraction,
decline mainly drive prolong refinery shutdown year limited importation crude oil amidst dearth foreign exchange liquidity domestic market,
accordingly refine petroleum product include auto diesel petrol furnace oil decline,
manufacture coke refined petroleum product subsector record occasional month month increase february june august september december year,
subsector manufacture leather related product chemical chemical product register positive growth,
manufacture leather related product subsector grow cent year year compare marginal growth cent buoy expansion finish leather natural leather jacket shoe,
manufacture chemical chemical product subsector register overall growth cent year year,
contribute growth production poly bag detergent powder expand notably year,
figure capacity utilisation source department census statistic note weight category parenthesis food product,
wear apparel non metallic mineral product,
beverage coke refined petroleum product,
rubber plastic product overall capacity utilisation q q,
central bank sri lanka annual report,
manufacture rubber plastic product subsector manufacture basic pharmaceutical product pharmaceutical preparation subsector record contraction year,
manufacture rubber plastic product record significant year year expansion cent contract cent,
contraction rubber plastic product subsector primarily cause decline demand medical rubber glove follow decline covid case locally globally,
additionally reduction domestic manufacturing tyre zipper rubber sheet block rubber contribute contraction,
manufacture basic pharmaceutical product pharmaceutical preparation sub sector display gradual expansion onset pandemic induce demand medicine health relate product record year year contraction cent,
subsector iip include manufacture wood product furniture electrical equipment furniture paper paper product printing reproduction record medium register contraction manufacture tobacco product machinery equipment subsector record expansion,
account decrease production corrugate paper paper bag exercise book manufacture paper paper product subsector show tepid performance,
accordingly paper paper product subsector report substantial year year drop cent,
printing reproduction recorded medium subsector witness contraction cent year year mainly supply shortage period review decline printing currency note news paper compare previous year,
overall performance manufacturing electrical equipment affect subdue demand electric panel board coil device,
manufacture machinery equipment sub sector record year year growth cent compare cent growth observe previous year,
manufacture tobacco product grow cent year year record expansion second consecutive year support mainly increase manufacturing cigarette,
industrial policy institutional supportduring year government continue support growth development industrial sector implementation numerous policy initiative assist industrial sector recover impact pandemic follow economic crisis,
ministry industry finalise national policy industrial development napid period view institute comprehensive holistic policy framework industrial sector development sri lanka,
napid aim establish national industry base globally competitive figure contribution year year change iip source department census statisticsother manufacture non metallic mineral product,
coke refined petroleum product wear apparel food product iip growthnote weight category parenthesis q q,
national output expenditure income employmentpromote inclusive growth,
order carry activity napid strategic implementation plan expect prepare year period include implementation framework mechanism monitoring evaluation methodology conduct periodical review,
february finalise napid strategic implementation plan period submit cabinet minister approval,
cabinet minister approve february resumption production embilipitiya paper mill public private partnership ppp scheme discontinue,
project include investment dollar million phase development aim manufacture industrial grade paper direct indirect export market upgrade machinery infrastructure,
factory expect generate annual production metric ton paper expect completion,
activity pertain recommence operation kurunchathivu saltern ppp model underway year,
completion project saltern expect produce annual salt production metric ton,
furthermore local assembly automobile continue expand standard operating procedure sop guideline automobile manufacturing assembling component manufacturing spare part,
end period review manufacturing company register sop vehicle assemble year,
meantime sri lanka institute biotechnology slibtec collaboration international partner undertake initiative establishment sri lanka biotechnology innovation park,
park envisage epicenter biotechnology innovation country attract local international investment sri lanka boost sri lanka potential hi tech export,
sme connect platform develop assistance asian development bank launch purview national enterprise development authority neda october,
platform expect provide access knowledge skill network sme particular focus woman lead sme improve woman financial literacy business management capability,
nipunatha udana programme commence progress north western province order cater vocational training requirement region,
initiative relate establishment german technical college matara district progress,
accord national budget circular implementation promotional development activity relate industrial sector curb april tight budgetary constraint government,
export development board edb board investment boi initiate measure attract foreign investment actively promote export orient domestic manufacturing industry,
propose interim budget edb implement measure reactivate national packaging center aim promote develop indigenous packaging material design cater international market,
edb develop national export brand promotional plan period promote earmarked export sector economy include apparel gem jewellery electronic electronic product rubber rubber base product boat boat building,
series meeting conduct year export advisory committee appoint edb cover key export sector identify thematic priority improve performance export sector,
promotional event include trade fair,
central bank sri lanka annual report market linkage create programme awareness session capacity building programme conduct target promotion export orient business year,
boi establish new business partnership database serve platform connect local international enterprise assist firm research institution start up seek suitable partner upcoming business proposal innovation,
investor facilitation center implement streamline expedite investment approval process strengthen interagency coordination enhance ease business investor,
government agency continue implement numerous initiative facilitate domestic industrial sector,
neda continue effort promote sri lanka brand provide recognition business local resource,
end neda conduct district level micro level trade fair open sri lanka franchise shop matale district,
neda conduct entrepreneur training programme assist create business business expansion regional entrepreneurship development programme implement cluster development programme industrial cluster field food dehydration bee honey wood apple seasonal product jack fruit rush reed palmyra,
industry national industrial exhibition conduct industrial development board idb february participation industry helped create new market investment opportunity local industrialist,
getup startup wealthy nation initiative commence idb intention spur country industrial entrepreneurial growth,
programme cover aspect promote entrepreneurship include entrepreneurial club initiative school student business clinic address problem face entrepreneur web base investor pool programme direct investment sme industrialist,
idb mobile app emergency response number introduce programme create platform facilitate close interaction industrialist idb,
national productivity secretariat nps continue conduct productivity improvement programme aim empower small scale entrepreneur country,
industrial chamber continue assist domestic sme industry country training engage promotional effort,
ceylon chamber commerce ccc continue facilitate numerous trade delegation network event international webinar discussion forum promote trade investment year,
theme business tip trade border ccc partner united states agency international development usaid bolster trade knowledge export orient sme,
national chamber commerce sri lanka nccsl remain committed educate empower sme sector organising range training programme island wide,
nccsl enter memorandum understanding government authority regional chamber international organisation aim network enhanced trade opportunity promote woman entrepreneurship,
government initiative promote technological advancement persist year,
complement overall effort government national institute fundamental study nifs formulate technology transfer policy facilitate application technology research domestic manufacturing industry,
nif process promote biodiesel production algae industrial purpose collaboration private sector company introduce biofilm bio fertiliser acre paddy field line agriculture,
national output expenditure income employmentdevelopment initiative,
sri lanka institute nanotechnology slintec carry research key sector include energy advanced material mineral textile material process,
national innovation agency actively participate activity year encourage innovation drive industrial development special focus identify gap pertain commercialisation intellectual property sri lanka,
national science foundation nsf continue provide research grant research scholar facilitate new product development initiative,
government continue facilitate industry address economic crisis relate issue ensure continuity industrial sector,
facilitate continuation industrial activity period acute fuel shortage ministry industry initiate measure issue recommendation letter supply fuel require industrial factory sri lanka transport board manage depot,
support local manufacturer ensure ability sustain operation foreign exchange liquidity facility provide indian line credit enable import necessary raw material,
central bank sri lanka request license bank non bank financial institution provide appropriate credit concession case case basis affected borrower economic sector include micro small medium enterprise msme sector period month july take account adverse consequence unprecedented macroeconomic stress covid pandemic,
fulfil liquidity requirement sme dollar million undisbursed small medium sized enterprise line credit loan scheme reallocate emergency response initiative ministry finance economic stabilisation national policy,
primary objective reallocation provide affordable work capital loan rate determine average weighted deposit rate awdr plus reasonable margin sme engage agriculture tourism export orient sector,
consider challenge face apparel manufacturer surge raw material price cabinet minister grant approval august provide tariff concession importation necessary accessory item manufacture locally construction mining quarryingconstruction activity suffer severe setback wake supply demand impediment result contraction cent value add term compare growth cent report,
shortage raw material fuel couple soar input cost lack supplier credit overdue payment complete government fund project lead supply issue construction activity,
exacerbate demand hindrance stem suspension government fund project high interest rate environment curtail private investment,
lacklustre performance construction industry reflect construction relate indicator,
accordingly total cement availability country record substantial decline cent compare marginal decline cent record build material import decline substantially cent compare cent growth,
credit private sector grant licensed commercial bank personal housing construction record contraction end december,
mine quarry activity comprise mainly mining activity provide input construction activity sand mining contract cent compare growth cent record,
reflect setback gem mining gem export volume record decline cent,
central bank sri lanka annual report electricity water waste treatment,
value add electricity water waste treatment activity contract cent compare cent growth record drive decline electricity gas supply relate activity,
accordingly electricity gas steam air conditioning supply activity significantly disturb supply impediment upward price revision year contract cent compare growth cent record,
year water treatment supply activity sewerage treatment disposal activity grow cent cent respectively recover cent cent contraction record,
servicesservice activity largely affect prolong energy crisis limit availability good high inflation contract cent value add term compare growth cent record,
overall contraction drive decline real estate insurance financial human health professional service,
programming programming broadcasting wholesale retail trade activity contract year,
accommodation food beverage service grow significantly mainly post pandemic recovery tourist activity transportation telecommunication education public administration personal service postal courier service record positive contribution,
pmi service activity compile monthly central bank mirror development service activity,
demand sale sub index bo relate service indicate contraction average year,
wholesale retail tradesupply impediment subdue demand condition dampen wholesale retail trade activity result marginal contraction cent value add term compare cent growth record,
supply setback stem low harvest maha season import restriction result considerable contraction import volume include consumer good import disruption fuel supply adversely affect trade activity period year,
subdue figure growth rate service activity source department census statistic base gdp estimate base year insurancereal estate activitiesfinancial servicesprogramming broadcast activitieshuman health activitiesprofessional servicesit programming consultancy related activitieswholesale retail tradepublic administrationtelecommunicationtransportationeducationaccommodation food beverage servicesfigure purchasing manager index service source central bank sri lanka,
diffusion index range index value neutral level denote expansion value denote contraction respective activity general,
pmi business activity indexjan feb mar apr mayjun jul aug sep oct nov dec jan feb mar apr mayjun jul aug sep oct nov dec,
national output expenditure income employmentdemand condition cause deterioration purchase power high inflationary environment increase taxis utility tariff demoralise consumer credit high interest rate aggravate situation especially second year,
value add transportation storage activity grow cent compare marginal growth cent record mainly post pandemic recovery,
consider transportation relate indicator passenger kilometre operate sri lanka transport board private bus operator sri lanka railway increase considerably reflect increase demand public transportation mode amidst significantly high fuel cost preferential supply fuel public transportation,
air transportation service gradually recover revival tourism activity evidence increase passenger kilometre fly srilankan airline year,
relation port relate activity container handling term foot equivalent unit cargo handling contract year mainly slowdown global trade volume,
accommodation food service activitiesaccommodation food beverage service activity severely affect easter sunday attack subsequently covid pandemic record substantial growth cent compare cent growth record,
significant increase tourist arrival year year basis bolster activity despite disruption cause energy shortage social unrest,
order facilitate tourist turbulent environment hotel offer exclusive package include complimentary transport facility especially period fuel shortage prevail,
depreciation local currency sri lanka attractive holiday destination foreign tourist,
exaggerated negative portrayal sri lankan economic crisis circulate certain international medium cautious travel advisory issue foreign government hinder growth potential tourism industry year,
limit fuel availability qr code system prevent local tourist travel long distance,
financial insurance real estate activity include ownership dwelling value add financial insurance real estate activity include ownership dwelling contract cent compare cent growth account significant contraction report value add activity,
high interest rate environment lower overall demand credit high price level prevail period hamper value add service consider constant price,
reveal credit supply survey conduct central bank quarterly basis willingness lend decline mainly deterioration repayment capacity borrower high inflationary environment weak economic condition,
accordingly financial service activity auxiliary financial service contract cent compare cent growth real estate activity include ownership dwelling contract cent year compare cent growth previous year,
central bank sri lanka annual report reinsurance pension funding activity contract significantly cent compare growth cent record mainly subdued performance pension funding activity,
information communicationtelecommunication programming consultancy service activity outperform economic activity pandemic contract marginally cent value add term compare substantial growth cent record normalisation pandemic induce demand prevail previous year slowdown domestic foreign economy,
interruption electricity fuel supply shortage technological product hamper activity,
accordingly programming consultancy related activity main contributor segment contract cent compare cent growth record affect slowdown global demand domestic supply issue prolong power cut prevail period,
telecommunication activity grow slow rate cent compare cent growth record attributable subdued demand result deterioration purchase power amid high inflationary condition upward revision taxis impose telecommunication service,
service activity value add service activity contract affect adverse economic condition prevail country,
activity dampen supply shortage half affect year subdued demand condition,
accordingly professional service programming broadcasting activity contract cent cent respectively comparatively unfavourable business environment,
human health activity grow high rate covid affected year contract cent,
education public administration defense personal service postal courier service contribute positively overall economic growth,
expendituregross domestic expenditure gde combination consumption investment expenditure economy grow high rate cent current price largely account elevated price level prevail year compare cent growth record,
gde consumption expenditure grow cent year compare cent growth investment expenditure grow cent year compare cent growth record previous year,
external net external demand current price improve cent contrast cent deterioration record previous year,
substantial growth cent export good service year surpass cent growth import good service,
comparatively slow growth import largely attributable decline import volume import restriction foreign exchange liquidity shortage export benefit sharp depreciation sri lanka rupee currency major export destination,
accordingly gdp current price aggregate gde net external demand record growth cent compare cent growth,
national output expenditure income employmentgde constant price contract substantially largely attributable deterioration purchase power high interest rate environment discourage consumption investment scarcity good,
accordingly consumption investment decline cent cent respectively result cent contraction gde year compare cent growth record,
net external demand constant price turn positive substantial growth cent combine outcome increase export decline import volume term,
consequently gdp constant price contract cent compare cent growth,
consumptionconsumption expenditure large expenditure component economy grow high rate cent current price compare cent growth record mainly surge consumer price,
private consumption expenditure pce major component consumption expenditure substantially grow year account cent total consumption,
government consumption expenditure gce grow high pace compare previous year contribute total consumption growth,
outpace contraction household consumption real term deterioration purchase power consumer supply shortage pce current price grow cent compare cent growth drive inflated price,
regard notable contribution observe major pce category food non alcoholic beverage transport grow cent cent respectively year,
price level import consumer item increase significantly lead increase global commodity price depreciation local currency contribute substantial increase pce current price,
upward revision energy price increase household expenditure particularly transport water electricity gas fuel spill pce category,
table aggregate demand itemcurrent market price rs mn constant price rs mn b c,
