sentence,macroeconomic factor
year research adaptation low intensity harvesting system carry aim reduce production cost handle labour shortage particularly non traditional area,
result approximately hectare rubber land own smallholder plantation company convert day tap system,
screen clone identify resistant clone leaf disease complete effort prevent significant yield loss cause disease measure underway identify climate resilient clone sustainable rubber cultivation,
central bank sri lanka annual report year programme aim raise awareness rubber farmer improve technique apply slow release fertiliser enhance nutritional intake plant carry rubber grow region cover monaragala middeniya matugama horana bulathsinhala kalutara kegalle ratnapura,
rubber development department rdd continue engage expand rubber cultivation extent new planting replanting activity year,
new planting programme latex harvesting commence establish rubber field mullaitivu northern province,
measure take popularise different type rubber base intercrop system crop diversification unutilised land field demonstration different trial field,
light rise cost cultivation revision subsidy scheme replanting new planting effect january order reduce number installment provision subsidy fund alter subsidy,
series awareness programme sustainable harvesting proper management rubber bark conduct financial support national science foundation sri lanka,
train programme rubber product manufacturing target small medium sized entrepreneur rubber smallholder conduct year aim promote value addition rubber sector strengthen integration local rubber product global value chain,
coconutthe coconut sector register high annual production favourable weather condition prevail,
accordingly total nut production increase million nut record year year increase cent notable increase cent record,
increase production largely support distribute rainfall couple ideal air temperature table trend principal agricultural cropscategory unit b change b,
tea production kg mn low grown kg,
mn high grow kg mn total extent hectare extent bear hectare,
cost production rs kg average price colombo auction rs kg,
export o rs kg,
replant hectare new planting hectare,
value add gdp gdp,
rubber production kg mn sheet rubber,
mn crepe rubber kg,
total extent hectare area tap hectare cost production rs kg average price colombo auction rss rs kg,
export o rs kg replant hectare new planting hectare value add gdp gdp,
coconut production nuts mn desiccate coconut nuts mn coconut oil nuts mn nuts mn total extent hectare,
cost production rs nut average price producer price rs nut export o g rs nut replant plant hectare new planting hectare value add gdp gdp revise provisional,
include green leaf supplier profit margin,
grow process extent cover cultivation assistance scheme rubber development department,
major coconut kernel product extent cover cultivation assistance scheme coconut cultivation board ccb,
extent newly plant calculate base coconut seedling distribute ccb conversion rate seedling hectare,
source sri lanka tea boardtea small holding development authorityministry plantationdepartment census statisticsrubber development departmentcoconut cultivation board coconut development authoritycolombo tea broker associationthe ceylon chamber commercesri lanka customscentral bank sri lanka,
national output expenditure income employmentmain coconut grow area,
favourable effect outweigh immediate negative impact limited application chemical fertiliser coconut cultivation,
increase nut production coconut base product witness improvement year,
accordingly production desiccated coconut increase cent year year metric ton metric ton record,
coconut oil production increase notably cent year year metric ton reflect restriction impose importation coconut oil palm oil availability adequate nut oil production,
production coconut milk powder increase year cent year year coconut cream coconut milk production record contraction cent cent respectively,
despite improve performance coconut sector lag effect delayed insufficient application chemical fertiliser affect coconut yield near future,
lag effect favourable precipitation receive expect outweigh negative consequence insufficient fertiliser application,
despite improved coconut production price coconut coconut base product remain elevated level,
average retail price coconut increase cent year year rs nut nut price exceed r late reach historically high price coconut,
average auction price coconut colombo coconut auction record rs nut register increase cent rs nut,
desiccated coconut price local market increase marginally cent year year rs kilogramme year,
average retail price coconut oil bottle ml increase cent rs increase cent record,
total export volume desiccated coconut coconut oil copra register notable growth reflect favourable support increase domestic production,
government effort improve productivity coconut sector continue implementation initiative aim promote sector,
accordingly coconut cultivation board ccb initiate measure provide high yield coconut cultivar improve productivity exist coconut land,
development new coconut seed garden produce high yield kapsuwaya hybrid coconut cultivar underway year hand pollination programme produce kapruwana hybrid variety infille vacancy kiniyama seed garden carry collaboration chilaw plantation ltd,
subsidy scheme include supply coconut seedling subsidise rate subsidy rehabilitation coconut land replanting underplanting new planting continue,
light increase intensity white fly p damage pilot project conduct control white fly affect coconut plantation area include dankotuwa nattandiya wennappuwa recommendation control white fly disease chemical bio chemical issue year,
measure take mitigate impact fuel shortage coconut processing factory supply require fuel ensure uninterrupted operation industry,
effort expand global reach ceylon coconut brand turn promote value addition coconut industry create opportunity global market country coconut industry,
central bank sri lanka annual report minor,
export cropsthe growth momentum minor export crop production continue despite issue domestic supply chain fertiliser availability,
accord provisional estimate department export agriculture dea production minor export crop record notable increase cent year year metric ton metric ton record,
government decision maintain restriction importation minor export crop measure curb import expenditure amidst bop pressure combat rise price domestically amidst increase global demand spur farmer actively cultivate crop result notable improvement performance sector,
production cinnamon clove cardamom coffee cocoa nutmeg areca nut betel leave witness growth production pepper decline,
total export volume export agriculture crop sector register year year contraction cent export earning rupee term increase notably cent year year,
earning export cinnamon record significant growth cent year year largely contribute growth export earning export agriculture crop,
measure undertake government authority strengthen minor export agriculture sector year,
accordingly arrangement export development board edb support public private sector stakeholder obtain geographical indication gi certification ceylon cinnamon european union eu commission,
expect enhance worldwide recognition excellence distinctive feature product attribute sri lanka,
dea carry research development activity expand export agriculture crop cultivation non traditional area anuradhapura polonnaruwa ampara vavuniya jaffna,
dea conduct programme aim introduce minor export crop like pepper areca nut ginger turmeric betel leave identify area intention expand cultivation extent,
order enhance quality production introduction popularisation organic cultivation good agricultural practice gap good manufacturing practice gmp carry,
field crop follow bumper harvest production field crop ofc witness notable decline largely drive domestic shortage fertiliser agrochemical supply chain disruption,
drop domestic production ofc amidst lack availability fertiliser agrochemical largely mitigate import burden country import expenditure,
accordingly overall production ofc decrease cent year year metric ton combine result cent decline production maha season decline cent yala season,
maize production register significant decline cent metric ton year compare owe shortage high cost agricultural input,
decline domestic maize production importation maize increase metric ton metric ton fulfil demand animal feed industry,
potato production register decline cent year year metric ton potato import increase cent,
big onion production decrease,
national output expenditure income employmentsignificantly cent year year metric ton compare previous year importation big onion increase cent year year metric ton,
domestic production ofc finger millet kurakkan cowpea soya bean record expansion year production red onion green gram black gram ground nut gingelly green chilli record decline,
government continue effort enhance domestic production ofc pave way improved food security,
accordingly field crop research development institute fcrdi functioning department agriculture doa institute measure year,
measure include development new variety field crop chilli onion maize finger millet cowpea black gram green gram breed programme maintenance recommend crop variety seed production recommend variety provide technical recommendation ofcs soil testing service technology dissemination,
effort require improve supply ofc implement national level ofc production plan encompass measure ensure adequate supply agricultural input fertiliser pesticide promote high quality seed production good soil crop management practice strengthen supply chain channel minimise foreign exchange outflow importation ofc potential produce domestically,
vegetablesthe supply vegetable decline owe combine impact domestic shortage fertiliser agrochemical supply chain disruption increase cost production,
total production vegetable decrease cent metric ton compare metric ton record,
maha season production vegetable contract cent metric ton previous maha season yala production decline cent metric ton compare corresponding season,
price vegetable continue remain elevated account low production transitory supply chain disruption cause fuel shortage year,
month june witness significant surge vegetable price attribute season cultivation intensify fuel scarcity,
slight moderation vegetable price local market observe start july distribution fuel transportation agricultural produce arrival seasonal harvest market august september,
vegetable price remain broadly elevated impact heavy rain predicament storage transportation facility,
metric ton vegetable worth dollar million export,
year measure undertake government authority enhance domestic vegetable production sustainable manner,
accordingly horticultural crop research development institute hordi function doa undertake measure year include development new vegetable variety introduction pest disease resistant vegetable variety management soil fertility vegetable cultivation technology development management pest disease vegetable cultivation promotion vegetable preservation nutrient management programme aim increase productivity efficiency sector,
central bank sri lanka annual report fruitsaccorde estimate dcs fruit production record mix performance,
production fruit decline cent previous year significant contraction production orange lime rambutan avocado melon mango papaya plantain pineapple record increase production,
year review metric ton fruit include banana papaw worth dollar million export metric ton fruit worth dollar million import,
despite grow demand locally grow fruit limitation impose government importation fruit curb import expenditure limited capacity local producer meet domestic demand couple supply chain issue hinder potential expansion domestic fruit sector,
importance improve capacity local fruit producer quality safety fruit supply domestic export market reiterate significant contribution fruit sector national economy term income employment opportunity nutritional wellbeing population,
promote good agricultural practice particularly usage agricultural input harvesting establish direct link producer exporter develop contract farming system minimise post harvest loss sector enable improve infrastructure fruit preservation storage value addition remain essential improve productivity sector,
accordingly measure undertake government promote local fruit production sector,
year fruit research development institute frdi function doa engage consultation planting development fruit plantation provide advisory service production technology fruit crop cultivation diagnose pest disease supply good quality planting material recommend fruit variety conduct research development project,
natural resource management centre doa complete assessment mapping potential area cultivation fruit crop include mango banana pomegranate pineapple rambutan durian financial technical support fao united nations,
upward trend sugar production witness hamper sugar industry experience setback amidst domestic fertiliser shortage,
year year basis total sugar production record contraction cent metric ton compare metric ton record,
contribute annual decline total sugar production production sevanagala pelwatte sugar factory decline cent cent respectively period review,
sugar production gal oya ethimale sugar factory record year year expansion cent cent respectively,
share sugar production gal oya sewanagala pelwatte ethimale account cent cent cent cent total domestic production respectively,
total extent sugarcane cultivation include ratoon manage factory experience marginal decline cent year,
average yield sugar factory contract cent reflect acute shortage nutrient cane cultivation,
accordingly average yield stand metric ton hectare compare metric,
national output expenditure income employmentton hectare record,
accord sugarcane research institute sri end cent total domestic sugar requirement meet domestic production remainder demand fulfil import,
government continue undertake initiative aim strengthen local sugar industry reduce dependency import meet domestic sugar requirement,
recognise vast potential local production need promote local sugarcane cultivation meet domestic requirement sri continue effort aim develop domestic sugar industry,
take account need expand cultivation area improve factory capacity priority enhance local sugar production cabinet minister approve establishment new sugar factory weli oya sugar factory subsidiary lanka sugar company pvt ltd early,
progress relation establishment kantale sugar factory remain modest year legal issue,
establish seed cane multiplication nursery new variety specially release jaggery production vannerikulam kilinochchi progress,
effort initiate develop seed cane policy establish sustainable seed cane production supply chain establish special task force outline policy guideline ensure implementation domestic sugar industry policy framework,
livestock performance livestock sector hinder challenge pose economic crisis,
year entire dairy value chain severely impact scarcity high cost animal feed limit importation animal feed unavailability require chemical fertiliser pasture fodder cultivation difficulty storage transportation facility cause deepen foreign exchange liquidity crisis economy,
accord estimate dcs total national milk production decline cent year year million litre compare million litre record,
cow milk production decline cent year year million litre buffalo milk production record marginal contraction cent year year million litre,
average cost production cow milk increase notably rs litre rs litre record,
increase demand liquid milk shortage import domestic milk powder significant rise milk powder price farmer receive relatively high price locally produce liquid milk formal informal milk market year,
accordingly average farm gate price litre cow milk increase cent rs rs,
poultry sector continue grapple issue relate inadequate feed material poultry rear follow reduction table livestock sector statisticssubsector b change b,
million neat cattle buffalo,
national milk production million litre cow milk buffalo milk,
producer price cow milk rs litre,
national poultry meat production mt revise provisional source department census statistics department animal production health,
central bank sri lanka annual report domestically produce feed ingredient cause notable drop production paddy maize restrict import feed material amidst foreign currency liquidity issue,
result egg production decline cent year year million egg compare million egg produce,
department animal production health daph cost production egg increase notably rs rs,
chicken production record decline cent metric ton metric ton cost production chicken increase significantly rs kilogramme rs kilogramme,
despite government imposition price control egg chicken severe shortage supply particularly egg supply resultant hoarding stock keep egg price elevate year,
year year basis production mutton increase cent metric ton pork beef production decline cent cent respectively metric ton metric ton respectively,
consideration contemporary challenge encounter livestock industry effort enhance productivity sector sustain,
recent year sri lanka self sufficient egg chicken production domestic consumption requirement largely meet domestic production industry advance promising venture export market,
unavailability elevated cost feed material intensify production constraint lead supply shortfall animal protein,
situation challenge food security country,
context government collaboration daph undertake measure import maize suitable grain animal feed production promote domestic animal feed production sector reduce strain country external account,
daph carry project include livestock dairy breeding project increase milk production upgrading genetic potential exist cattle population sri lanka comprehensive mastitis control programme prevent control clinical subclinical mastitis vaccination programme farm animal foot mouth disease haemorrhagic septicaemia black quarter brucella disease,
financial assistance department agriculture united states market orient dairy mod project underway aim follow good practice improve productivity dairy manufacturer quality product,
fisherie fishery sector experience setback amidst challenge pose economic fallout,
total fish production decline cent metric ton compare previous year mainly drive disruption cause domestic fuel shortage fishing activity supply chain particularly relation marine fishing activity,
accordingly marine fish production account cent total fish production decline cent year year metric ton,
inland fishery sector record improvement year proper management water body increase fingerle stocking reservoir yield year year increase cent production year compare production,
retail price fish variety remain broadly elevate result increase,
national output expenditure income employmentlogistic cost upward revision kerosene price august november keep price high level year compare corresponding period,
accord ministry fishery total fish export contract cent year year reflect subdued performance sector fish import report year year contraction cent volume term period review,
amidst energy crisis fishery sector encounter setback prompt government measure ensure continuity fishery activity turbulent time safeguard sector severe economic shock enhance performance fishing industry,
accordingly provision fuel fishery activity ensure enable manual system identify filling station major fishery region priority basis distribute limited fuel stock,
development activity pertain fishery infrastructure base continue,
accordingly ministry fishery continue engage fishery sector development project prevent illegal unreported unregulated fishing activity ensure sustainable fishing practice,
construction wellamankara fishery harbour complete march harbour development project include gandara fishery harbour balapitiya fishery harbour rekawa fishery harbour underway,
lagoon conservation development project aim clean deepen lagoon increase natural fish population coastal area progress year measure take develop related infrastructure facility reduce post harvest loss,
national aquaculture development authority naqda continue effort increase inland fish aquaculture production contribute significantly boost fish export,
table fish production mt subsector change marine coastal lagoon,
shore inland fishery capture aquaculture shrimp farm total provisional source ministry fisheriestable availability major food commoditiesitem unit b production importsper capitaavailability kg year production,
importsper capitaavailability kg year production importsper capitaavailability kg year rice mt maize mt wheat mt big onion mt sugar mt potato mt fresh fish mt cow milk mn litre d,
coconut oil mt revise provisional,
mt paddy mt rice litre yearsource department census statisticssri lanka customslanka sugar company pvt ltd sevanagala unitlanka sugar company pvt ltd pelwatte unitgal oya hingurana sugar industries ltd ethimale plantation pvt ltd ministry fisheriescoconut development authority,
central bank sri lanka annual report community base fish breeding unit establish ampara trincomalee kilinochchi increase supply fish seed require reservoir stocking unit expect provide continuous supply carp fingerling inland culture,
year notable progress upgrade small scale fish seed production unit post larvae rearing rehabilitation improvement aquaculture development centre increase fish fingerle production,
shrimp farming lucrative commercial aquaculture activity country initiative take expand shrimp farming potential area,
accordingly measure implement promote shrimp culture activity introduce efficient water recirculation system improve biosecurity farming area continue dredging dutch canal establishment advanced electricity supply shrimp farm puttalam area,
addition shrimp farming sea weed sea bass sea cucumber milk fish farming develop promote commercial aquaculture production,
naqda facilitated community base sea weed farming sea area jaffna kilinochchi mannar puttalam,
measure take develop cluster base sea cucumber farm sea cucumber export village kilinochchi jaffna district plan underway establish aquaculture zone mannar,
naqda involve development ornamental fish industry include development new ornamental fish strain provision brood stock breed disease diagnosis facility training technical assistance aim increase high value ornamental fish production boost foreign exchange earning,
step take naqda establish marine ornamental fish breeding centre bangadeniya industry,
prolong energy crisis shortage key raw material owe lack foreign exchange liquidity banking system subdued demand condition prevail deterioration purchase power hinder industry activity part,
policy intervention helped control supply shortage year industry activity contract cent compare cent growth record owe multiple challenge emanate domestic external front,
subdued performance manufacturing construction activity lead contraction industry activity mining quarry activity electricity gas steam air conditioning supply activity significantly contract aggravate overall setback industry activity,
water collection treatment supply activity sewerage waste treatment disposal activity expand year positively contribute overall industry activity,
reflect development industry activity production demand sub index bo pertain industry indicate contraction average year,
figure growth rate industry activity source department census statistic base gdp estimate base year mining quarryingconstructionmanufacturingelectricity gas steam air conditioning supply activitieswater collection treatment supply activitiessewerage waste treatment disposal activity,
national output expenditure income employmentmanufacture manufacturing activity manufacture textile wear apparel leather relate product largely resilient domestic shock contract year adverse impact extended power cut shortage fuel key raw material logistic issue subdue demand condition,
accordingly value add overall manufacturing activity contract cent compare cent growth record,
manufacture food beverage tobacco product large contributor overall manufacturing activity contract substantially cent lead substantial contraction,
manufacture non metallic mineral product rubber plastic product basic metal fabricated metal product major contributor decline overall manufacturing activity value add term,
reflect development index industrial production iip compile dcs purchasing manager index pmi manufacturing activity compile central bank decrease average year,
pmi diffusion index compile base perception survey cover lead company capture monthly development compare previous month,
index industrial production value addition manufacturing activity register negative growth attribute host adversity stem unprecedented economic crisis experience sri lankan economy,
country bad economic crisis record manufacturing sector face multifacete challenge include shortage raw material disrupt transport network interrupt power supply soar input price adverse impact performance sector year,
overall market demand dampen year amidst surge inflation decrease real value disposable income hinder performance manufacturing sector,
reflect index industrial production iip overall manufacturing sector account cent total industry sector contract cent year year compare year year growth cent previous year,
largely contribute overall contraction iip subsector manufacture food product textile coke refined petroleum product non metallic mineral product rubber plastic product basic metal product report notable contraction,
